Query,Act_Filter,Top_Act,Top_Section,Top_Score,Embed_ms,Query_ms,Rerank_ms,Total_ms
83a34f92,How do I handle boundary disputes?,Labour Relations Act,10 – Disputes under Part,"If there is a dispute about the interpretation or application of any provision of this Part, any party to the dispute may refer the dispute in writing— (a) to the Cabinet Secretary to appoint a conciliator as specified in Part VIII; or (b) if the dispute is not resolved at conciliation, to the Employment and Labour Court for adjudication.",0.6269,-5.783060550689697,72.27,106.07,550.73,729.91
d94514d5,What benefits are casual workers entitled to?,Employment Act,37 – Conversion of casual employment to term contract,"(1) Notwithstanding any provisions of this Act, where a casual employee— (a) works for a period or a number of continuous working days which amount in the aggregate to the equivalent of not less than one month; or (b) performs work which cannot reasonably be expected to be completed within a period, or a number of working days amounting in the aggregate to the equivalent of three months or more, the contract of service of the casual employee shall be deemed to be one where wages are paid monthly",0.6956,0.7146399617195129,79.8,74.0,615.19,770.22
b1194ece,How do I claim unpaid salary from a former employer?,Employment Act,49 – Remedies for wrongful dismissal and unfair termination,"of any severance payable by law; (i) the right to press claims or any unpaid wages, expenses or other claims owing to the employee; (j) any expenses reasonable incurred by the employee as a consequence of the termination; (k) any conduct of the employee which to any extent caused or contributed to the termination; (l) any failure by the employee to reasonably mitigate the losses attributable to the unjustified termination; and (m) any compensation, including ex-gratia payment, in respect of term",0.6745,1.0156681537628174,75.45,48.2,570.19,695.16
70a675a0,Can traditional marriage be recognized in court?,Constitution of Kenya,45 – Family,"(1) The family is the natural and fundamental unit of society and the necessary basis of social order, and shall enjoy the recognition and protection of the State. (2) Every adult has the right to marry a person of the opposite sex, based on the free consent of the parties. (3) Parties to a marriage are entitled to equal rights at the time of the marriage, during the marriage and at the dissolution of the marriage. (4) Parliament shall enact legislation that recognises— (a) marriages concluded u",0.666,1.5911219120025635,73.03,50.83,423.1,548.22
d0a44f1f,How can I verify ownership of land before buying?,Land Act,100 – Purchase by chargee,"any, put upon the land before the auction, whichever amount is the greater. (4) If a chargee who has sold charged land to the chargee applies to the Registrar to be registered as the lawful owner of land under a land or lease, the Registrar may require that chargee to provide any evidence that the Registrar may specify showing that the provisions of this section have been complied with and the Registrar shall not be obliged to register any such land or lease until the chargee has so satisfied th",0.6747,0.9318215250968933,85.94,54.2,547.78,688.86
7b77cc7f,What are the steps for land subdivision?,Land Act,14 – Notification requirements applicable to allocation of public land,"subdivision having development control or other land use regulatory responsibility in the geographic area within which the public lands are located and to the head of any administrative subdivision having administrative or public services responsibility in the geographic area within which the lands are located. (5) The notice under subsection (4) shall be sent to other known interested parties including, but not limited to, adjoining landowners, persons in actual occupation of the land including",0.6261,-2.3175852298736572,86.02,73.15,513.63,673.67
7ee68558,Can community land be sold?,Constitution of Kenya,63 – Community land,"(1) Community land shall vest in and be held by communities identified on the basis of ethnicity, culture or similar community of interest. (2) Community land consists of— (a) land lawfully registered in the name of group representatives under the provisions of any law; (b) land lawfully transferred to a specific community by any process of law; (c) any other land declared to be community land by an Act of Parliament; and (d) land that is— (i) lawfully held, managed or used by specific communiti",0.7143,1.0907323360443115,70.8,20.79,529.65,622.38
e778b514,What happens after being charged in court?,Criminal Procedure Code,177 – Property found on accused person,"Where, upon the apprehension of a person charged with an offence, any property is taken from him, the court before which he is charged may order— (a) that the property or a part thereof be restored to the person who appears to the court to be entitled thereto, and, if he be the person charged, that it be restored either to him or to such other person as he may direct; or (b) that the property or a part thereof be applied to the payment of any fine or any costs or compensation directed to be paid",0.6829,0.7700627446174622,70.8,29.37,676.37,778.4
21537216,How is land rent determined?,Land Act,107 – Preliminary notice,"(1) shall be developed within six months of the commencement of this Act. (3) For purposes of this Part, ""land value index"" means an analytical representation showing the spatial distribution of land values in a given geographical area at a specific time. (4) In addition to any other principle that may be employed in calculating the land value index, the declared value of the land for purposes of payment of rates, rents or stamp duty shall be taken into account. (5) In assessing the value of fre",0.6776,-0.5883010029792786,66.3,117.54,480.29,665.32
d93bff93,How are debts handled during succession?,Law of Succession Act,86 – Debts to be paid before legacies,Debts of every description enforceable at law and owed by or out of an estate shall be paid before any legacy.,0.6711,-4.268587112426758,1246.27,548.59,1667.73,3467.1
bdfb5b20,Can widows remarry and still inherit?,Marriage Act,15 – Rights of widow and widowers,(1) A widow or widower may re-marry. (2) A widow or a widower may elect not to re-marry.,0.737,2.7234997749328613,98.88,103.75,745.23,948.99
7364abb7,What are the penalties for child labor?,Employment Act,64 – Penalty for unlawful employment of child,"(1) A person who employs, engages, or uses a child in an industrial undertaking in contravention of the provisions of this Part, commits an offence. (2) A person who uses a child in any activity constituting worst form of child labour commits an offence and shall on conviction be liable to a fine not exceeding two hundred thousand shillings or to imprisonment for a term not exceeding twelve months or to both. (3) It shall be a defence if the accused person proves that he genuinely had reason to ",0.7588,3.4178316593170166,62.95,123.48,559.16,746.96
61d0f2a8,What is the procedure for juvenile court hearings?,Children Act,228 – Preliminary inquiry,"(1) A preliminary inquiry shall be held in respect of every child prior to plea in accordance with rules made under this section, except where the child is below the age of twelve years, or the matter has been withdrawn. (2) A child's appearance at a preliminary inquiry shall be regarded as his or her first appearance in a Court as contemplated in the Criminal Procedure Code (Cap. 75). (3) The objectives of a preliminary inquiry shall be to— (a) consider the assessment report of the children’s o",0.6905,-2.986133575439453,83.59,230.76,604.87,927.55
4135b9ed,Can the President be sued?,Constitution of Kenya,143 – Protection from legal proceedings,"(1) Criminal proceedings shall not be instituted or continued in any court against the President or a person performing the functions of that office, during their tenure of office. (2) Civil proceedings shall not be instituted in any court against the President or the person performing the functions of that office during their tenure of office in respect of anything done or not done in the exercise of their powers under this Constitution. (3) Where provision is made in law limiting the time with",0.638,-1.2816344499588013,65.72,85.92,610.85,763.87
168de10f,What are the penalties for tax evasion?,Tax Procedures Act,88 – Penalty in relation to fraudulent claim for refund,"A person who fraudulently makes a claim for a refund of tax shall be liable to pay a penalty of an amount equal to two times the amount of the claim. 88A. Penalties for non-compliance with common reporting standard obligations (1) A person who makes a false statement or omits any information required to be included in an information return under section 6B, shall be liable to a penalty of one hundred thousand shillings for each such false statement or omission to imprisonment for a term not exce",0.6754,1.572785496711731,81.64,87.28,706.51,877.0
58e9c7e4,How can I terminate a lease agreement early?,Land Act,65 – Covenants implied in a lease on part of the lessor,"the lessee may terminate the lease, on giving one month’s notice to the lessor, if the land or building cannot be, or can no longer lawfully be, used for any of those purposes; and (g) to pay all rates, taxes, dues and other outgoings that are payable in respect of the leased land except to the extent otherwise specified in the lease. (2) There shall be implied in every lease covenants by the lessee empowering the lessor to— (a) either personally or by agents, enter, the leased land or buildings",0.6987,2.1131489276885986,76.63,60.9,556.23,694.75
22ccd108,What is unfair termination under Kenyan law?,Employment Act,45 – Unfair termination,"(1) No employer shall terminate the employment of an employee unfairly. (2) A termination of employment by an employer is unfair if the employer fails to prove— (a) that the reason for the termination is valid; (b) that the reason for the termination is a fair reason— (i) related to the employees conduct, capacity or compatibility; or (ii) based on the operational requirements of the employer; and (c) that the employment was terminated in accordance with fair procedure. (3) An employee who has b",0.7037,-0.4007725119590759,1307.39,2387.69,1406.68,6213.13,qwen3:4b
1286bda1,What is unfair termination under Kenyan law?,Employment Act,45 – Unfair termination,"(1) No employer shall terminate the employment of an employee unfairly. (2) A termination of employment by an employer is unfair if the employer fails to prove— (a) that the reason for the termination is valid; (b) that the reason for the termination is a fair reason— (i) related to the employees conduct, capacity or compatibility; or (ii) based on the operational requirements of the employer; and (c) that the employment was terminated in accordance with fair procedure. (3) An employee who has b",0.7037,-0.4007725119590759,1049.0,1616.04,605.28,3813.43,qwen3:4b
94c2d5be,what is PAYE,Income Tax Act,35 – Deduction of tax from certain income,"persons (except a commission or fee paid or credited to another insurance company); (e) a pension or a lump sum commuted or withdrawn from a registered pension fund or a lump sum out of a registered provident fund in excess of the tax exempt amounts specified in section 8(4) and (5), or any amount paid out of a registered individual retirement fund, or a benefit paid out of the National Social Security Fund in excess of the tax exempt amount specified in section 8(5); (ee) surplus funds withdraw",0.5681,-5.434032917022705,281.19,1360.5,737.45,35778.63,qwen3:4b
75e78e1c,what is PAYE,Income Tax Act,35 – Deduction of tax from certain income,"persons (except a commission or fee paid or credited to another insurance company); (e) a pension or a lump sum commuted or withdrawn from a registered pension fund or a lump sum out of a registered provident fund in excess of the tax exempt amounts specified in section 8(4) and (5), or any amount paid out of a registered individual retirement fund, or a benefit paid out of the National Social Security Fund in excess of the tax exempt amount specified in section 8(5); (ee) surplus funds withdraw",0.5681,-5.434032917022705,1094.54,23132.78,872.38,257882.74,qwen3:4b
ce979545,What should I do if I am arrested and not informed of the reason?,Constitution of Kenya,49 – Rights of arrested persons,"(1) An arrested person has the right— (a) to be informed promptly, in a language that the person understands, of— (i) the reason for the arrest; (ii) the right to remain silent; and (iii) the consequences of not remaining silent; (b) to remain silent; (c) to communicate with an advocate, and other persons whose assistance is necessary; (d) not to be compelled to make any confession or admission that could be used in evidence against the person; (e) to be held separately from persons who are serv",0.7504,3.463594436645508,1093.13,383.54,2461.57,193468.34,qwen3:4b
27ece8f0,Can an employer terminate an employee for redundancy without notice?,Employment Act,40 – Termination on account of redundancy,"(1) An employer shall not terminate a contract of service on account of redundancy unless the employer complies with the following conditions— (a) where the employee is a member of a trade union, the employer notifies the union to which the employee is a member and the labour officer in charge of the area where the employee is employed of the reasons for, and the extent of, the intended redundancy not less than a month prior to the date of the intended date of termination on account of redundanc",0.7659,6.417842388153076,769.7,366.47,887.17,157277.37,qwen3:4b
2d97fefd,what is PAYE,Income Tax Act,35 – Deduction of tax from certain income,"persons (except a commission or fee paid or credited to another insurance company); (e) a pension or a lump sum commuted or withdrawn from a registered pension fund or a lump sum out of a registered provident fund in excess of the tax exempt amounts specified in section 8(4) and (5), or any amount paid out of a registered individual retirement fund, or a benefit paid out of the National Social Security Fund in excess of the tax exempt amount specified in section 8(5); (ee) surplus funds withdraw",0.5681,-5.434032917022705,1408.08,1922.07,1792.93,5630.69,Qwen/Qwen3-8B-Instruct,hf
40029147,What is PAYE,Income Tax Act,35 – Deduction of tax from certain income,"persons (except a commission or fee paid or credited to another insurance company); (e) a pension or a lump sum commuted or withdrawn from a registered pension fund or a lump sum out of a registered provident fund in excess of the tax exempt amounts specified in section 8(4) and (5), or any amount paid out of a registered individual retirement fund, or a benefit paid out of the National Social Security Fund in excess of the tax exempt amount specified in section 8(5); (ee) surplus funds withdraw",0.5681,-5.434032917022705,1036.23,1358.88,959.87,3369.7,Qwen/Qwen3-8B-Instruct,hf
4b9687d0,What is PAYE,Income Tax Act,35 – Deduction of tax from certain income,"persons (except a commission or fee paid or credited to another insurance company); (e) a pension or a lump sum commuted or withdrawn from a registered pension fund or a lump sum out of a registered provident fund in excess of the tax exempt amounts specified in section 8(4) and (5), or any amount paid out of a registered individual retirement fund, or a benefit paid out of the National Social Security Fund in excess of the tax exempt amount specified in section 8(5); (ee) surplus funds withdraw",0.5681,-5.434032917022705,288.19,538.64,827.7,2040.36,Qwen/Qwen3-8B-Instruct,hf
3ee4d0c1,What happens when a tenant refuses to vacate despite eviction notice?,Distress for Rent Act,14 – Tenant holding premises after time notified to pay double rent,"If a tenant gives notice to his landlord of his intention to quit the premises held by him, at a time mentioned in the notice, and does not accordingly deliver up the possession thereof at the time specified in the notice, then the tenant or his executors or administrators shall from thenceforward pay to the landlord double the rent or sum which he should otherwise have paid, to be levied, sued for and recovered at the same times, and in the same manner, as the single rent or sum could be levied",0.703,-2.112579822540283,1110.14,1690.96,1266.94,5575.75,Qwen/Qwen2.5-7B-Instruct,hf
f2d7041f,what is PAYE,Income Tax Act,35 – Deduction of tax from certain income,"persons (except a commission or fee paid or credited to another insurance company); (e) a pension or a lump sum commuted or withdrawn from a registered pension fund or a lump sum out of a registered provident fund in excess of the tax exempt amounts specified in section 8(4) and (5), or any amount paid out of a registered individual retirement fund, or a benefit paid out of the National Social Security Fund in excess of the tax exempt amount specified in section 8(5); (ee) surplus funds withdraw",0.5681,-5.434032917022705,1256.16,1524.39,2251.25,5041.01,Qwen2.5-7B-Instruct,hf
ed568fb2,what is PAYE,Income Tax Act,35 – Deduction of tax from certain income,"persons (except a commission or fee paid or credited to another insurance company); (e) a pension or a lump sum commuted or withdrawn from a registered pension fund or a lump sum out of a registered provident fund in excess of the tax exempt amounts specified in section 8(4) and (5), or any amount paid out of a registered individual retirement fund, or a benefit paid out of the National Social Security Fund in excess of the tax exempt amount specified in section 8(5); (ee) surplus funds withdraw",0.5681,-5.434032917022705,1010.56,1496.42,1012.62,4792.6,Qwen2.5-7B-Instruct,hf
902de276,How can someone be dismissed lawfully?,Employment Act,44 – Summary dismissal,"such matters or the decision of an employer to dismiss an employee summarily under subsection (3) shall not preclude an employer or an employee from respectively alleging or disputing whether the facts giving rise to the same, or whether any other matters not mentioned in this section, constitute justifiable or lawful grounds for the dismissal if:— (a) without leave or other lawful cause, an employee absents himself from the place appointed for the performance of his work; (b) during working hou",0.7072,2.9663679599761963,1008.92,1442.85,989.7,4715.61,Qwen2.5-7B-Instruct,hf-router
fb6e9bb1,How can someone be dismissed lawfully?,Employment Act,44 – Summary dismissal,"such matters or the decision of an employer to dismiss an employee summarily under subsection (3) shall not preclude an employer or an employee from respectively alleging or disputing whether the facts giving rise to the same, or whether any other matters not mentioned in this section, constitute justifiable or lawful grounds for the dismissal if:— (a) without leave or other lawful cause, an employee absents himself from the place appointed for the performance of his work; (b) during working hou",0.7072,2.9663679599761963,132.57,1322.61,633.12,2977.54,Qwen2.5-7B-Instruct,hf-router
246e67f7,What happens when a tenant refuses to vacate despite eviction notice?,Distress for Rent Act,14 – Tenant holding premises after time notified to pay double rent,"If a tenant gives notice to his landlord of his intention to quit the premises held by him, at a time mentioned in the notice, and does not accordingly deliver up the possession thereof at the time specified in the notice, then the tenant or his executors or administrators shall from thenceforward pay to the landlord double the rent or sum which he should otherwise have paid, to be levied, sued for and recovered at the same times, and in the same manner, as the single rent or sum could be levied",0.703,-2.112579822540283,1053.7,1542.19,1090.86,3689.18,retrieval-only
9698fafd,what is PAYE,Value Added Tax Act,19 – When tax is due - When tax is due,"(1) Tax shall be due and payable at the time of supply. (2) Notwithstanding the provision of subsection (1), a person may defer payment of tax due to a date not later than the twentieth day of the month succeeding that in which the tax became due. (Act No. 8 of 2021, s. 26)",,,,,,27223.85,proxy
4c50dbbd,What happens when a tenant refuses to vacate despite eviction notice?,Distress for Rent Act,14 – Tenant holding premises after time notified to pay double rent - Tenant holding premises after time notified to pay double rent,"If a tenant gives notice to his landlord of his intention to quit the premises held by him, at a time mentioned in the notice, and does not accordingly deliver up the possession thereof at the time specified in the notice, then the tenant or his executors or administrators shall from thenceforward pay to the landlord double the rent or sum which he should otherwise have paid, to be levied, sued for and recovered at the same times, and in the same manner, as the single rent or sum could be levied",,,,,,35132.74,proxy
3f910cf4,How can someone be dismissed lawfully?,Constitution of Kenya,75 – Conduct of State officers - Conduct of State officers,"(1) A State officer shall behave, whether in public and official life, in private life, or in association with other persons, in a manner that avoids— (a) any conflict between personal interests and public or official duties; (b) compromising any public or official interest in favour of a personal interest; or (c) demeaning the office the officer holds. (2) A person who contravenes clause (1), or Article 76, 77 or 78(2)— (a) shall be subject to the applicable disciplinary procedure for the relev",,,,,,59048.72,proxy
